,description_x
1444,A martial artist faces his biggest test when he has to travel to Bangkok to rescue the woman he loves from the clutches of his romantic rival.
1455,A remote village situated neither in India or Pakistan becomes its own republic after inmates at the local mental asylum bust loose and take over.
1456,A remote village situated neither in India or Pakistan becomes its own republic after inmates at the local mental asylum bust loose and take over.
1465,Three cheating husbands end up paying the price for their infidelities when their spouses hire a private detective – who falls for one of the wives.
1471,"A group of students celebrates New Year's at a remote Belgian estate, where their substance-fueled revelry soon descends into a bloodstained nightmare."
1472,"Plagued by dreams of an alien invasion, a family man faces his worst nightmare when an extraterrestrial force begins exterminating Earth's inhabitants."
1476,"After his friend is shot, Jon finds a mathematical pattern behind deaths that occurred at the same location and sets out to warn the next young victim."
1477,"After his friend is shot, Jon finds a mathematical pattern behind deaths that occurred at the same location and sets out to warn the next young victim."
1480,"After moving to Australia, an American teen convinces her new friends to form a cheer squad and take on their biggest rivals in competition."
1481,A shocking assault inspires horrific violence when a group of teens encounters a girl from their school while camping in a remote spot.
1485,A man's instant attraction to a woman becomes an obsession as he adopts a friend's identity and even commits murder in order to get closer to her.
1486,"Wary of dishonesty in relationships, two young women embark on a 24-hour experiment on intimacy, but their romance flounders as the clock winds down."
1492,"While traveling with her German boyfriend, Selma is confronted by the violent remnants of the Bosnian War and the ethnic cleansing her family faced."
1496,"Two strangers meet on a train and form a bond that evolves over the years. After a separation, they reconnect and reflect on their love for each other."
1502,"After returning from a dangerous tour of duty, an Army doctor finds that working the night shift at a San Antonio hospital can be treacherous, too."
1503,"A young woman eager to avoid an arranged marriage moves to Mumbai, where she learns hard truths about show business, life and love."
1505,"When Harper is sent to Spain for an important work meeting, her hard-partying friends tag along and convince her to pursue a fling with a famous DJ."
1506,"When Harper is sent to Spain for an important work meeting, her hard-partying friends tag along and convince her to pursue a fling with a famous DJ."
1508,"Inspector Gadget is back and must face his old enemy, the evil Dr. Claw, who has reactivated MAD, his global crime syndicate."
1512,"A former addict moves to a new city with her children for a fresh start, but her struggle soon takes on an unexpected, supernatural dimension."
1513,"Talented pooches from around the world compete to be the next Pup Star, but behind-the-scenes schemes threaten to ruin the fun."
1515,"Facing an inevitable outcome, terminally ill patients meet extraordinary medical practitioners seeking to change our approach to life and death."
1516,"Facing an inevitable outcome, terminally ill patients meet extraordinary medical practitioners seeking to change our approach to life and death."
1517,"When a 17-year-old learns the TV news host she pines for is engaged, she and her best friend launch an elaborate plan to prevent his marriage."
1518,A Chinese pharmaceutical lawyer framed for a vile crime teams up with a sharp-witted Japanese detective to stop a dangerous corporate plot.
1519,Four cops escorting a mobster to a high-security prison fight for survival when a gang boss orchestrates a riot from outside to silence their charge.
1526,"A newcomer ekes out a living in LA as a professional audience member on infomercials, but life gets complicated when he's thrust into the spotlight."
1529,Four best friends navigate loss and major life changes – and smoke a lot of weed – during their last two weeks of high school.
1531,"In the wake of an extraterrestrial invasion, a suspended L.A. cop teams up with survivors to stop the onslaught and rescue human captives."
1536,"A former medical student battles for survival against an evil human-zombie hybrid determined to destroy her, in this reimagining of the 1985 classic."
1540,Four friends become overnight millionaires after selling their video game start-up. But their newfound status tests their friendship and resolve.
1541,Four friends become overnight millionaires after selling their video game start-up. But their newfound status tests their friendship and resolve.
1542,Four friends become overnight millionaires after selling their video game start-up. But their newfound status tests their friendship and resolve.
1550,"Following a devastating alien invasion, an American soldier and a French foreign aid worker attempt to find refuge in the Kenyan countryside."
1551,Groundbreaking artists share their life stories in this vibrant documentary series that captures hip-hop's impact on global culture.
1552,"On a bleak future Earth, a soldier endures a radical genetic transformation to save humanity. But his wife fears he's becoming more creature than man."
1557,Three buddies with big dreams go from underachieving slackers to badass warriors when their posh hotel is taken over by terrorists.
1559,Neil Young and his band of outlaws sow seeds of strange mischief and musical wonder under Western skies in this dreamlike film by Daryl Hannah.
1561,Neil Young and his band of outlaws sow seeds of strange mischief and musical wonder under Western skies in this dreamlike film by Daryl Hannah.
1562,Neil Young and his band of outlaws sow seeds of strange mischief and musical wonder under Western skies in this dreamlike film by Daryl Hannah.
1574,"An American soldier imprisoned in postwar Japan enters the dark world of the yakuza, adopting their way of life in repayment for his freedom."
1575,"After a daring heist, three fugitives lock themselves in a warehouse hoping to evade the police, but find a worse threat as they fight to stay alive."
1576,"A team of mercenaries working with the CIA accepts an off-the-books mission in Chernobyl, where deadly human-controlled droids prepare an ambush."
1582,"Separated at birth, twins Raja and Prem couldn't be more different. But when fate puts them both in London, they start being mistaken for each other."
1585,"""Trailer Park Boys"" John Paul Tremblay, Robb Wells and Mike Smith host this foulmouthed live kick-off of their Web-based Swearnet network."
1592,The longtime mayor of Marseille is preparing to hand over the reins to his protégé when a sudden and ruthless battle erupts for control of the city.
1595,"Four friends with a long-standing – but strained – connection take a hiking trip into the Swedish wilderness, from which they may never return."
1601,"Following a tragedy, a mother and her teen son move to a relative's vacant vacation home, where eerie and unexplained forces conspire against them."
1604,"A desperate group of refugees attempts to recolonize Earth 20,000 years after Godzilla took over. But one young man wants revenge above all else."
1609,"In this Hindi version of ""Aval,"" a young couple's relationship is shaken to its core when a mysterious and troubled family moves into the neighborhood."
1612,"In his quest for true love, Dylan found chlamydia. Joined by friends Evie and Luke, he relives past encounters as he notifies all his former partners."
1613,"In his quest for true love, Dylan found chlamydia. Joined by friends Evie and Luke, he relives past encounters as he notifies all his former partners."
1614,"In his quest for true love, Dylan found chlamydia. Joined by friends Evie and Luke, he relives past encounters as he notifies all his former partners."
1615,"Four preschool moms with little in common need a night out to take a break from their kids. But one thing leads to another, and things get rowdy."
1628,"When Shankar, who performs on the road with partner Chanchal and elephant Appu, falls for a Russian circus performer, jealousies and conflicts arise."
1632,Three unsuspecting American tourists visit a mysterious mountain shrine in Japan despite uncanny warnings from local inhabitants to stay away.
1633,"When a teenager discovers he's not really human, he ventures out to a remote island to explore his roots and confronts a series of wild challenges."
1634,"When a teenager discovers he's not really human, he ventures out to a remote island to explore his roots and confronts a series of wild challenges."
1640,An ambitious young law enforcement graduate is thrilled when her idol takes her on as a trainee. But his methods aren't anything like she imagined.
1643,"In lawless badlands, reclusive Cabeleira sets out to discover the fate of his gunman father and grows to be a feared assassin himself."
1647,"A devious businessman covets his partner's priceless treasure map, while a related murder case calls into question some biological family ties."
1652,The arrival of an enigmatic struggling musician in Malibu shakes the ground beneath the feet of a teenage girl and her surfer boyfriend.
1653,Returning Pup Star champ Tiny has her Yorkie paws full after an evil rival replaces her with street dog Scrappy during the national competition.
1665,Two kids and their pet dog (aka the Ghost Patrol) get a call about an old manor and soon find they are investigating their first real haunted house.
1670,"Banished to a wasteland of undesirables, a young woman struggles to find her feet among a drug-soaked desert society and an enclave of cannibals."
1671,"A Melbourne obstetrician in her thirties struggles with the increasingly chaotic family, romantic and professional aspects of her life in this drama."
1673,"Her straitjacketed life turned topsy-turvy by hunky Xavier, Evie discovers a new freedom – even though her man just might be an end-of-days crackpot."
1680,"When amateur ghost hunters visit an abandoned house, their investigation turns into a massacre, leaving questions for a detective and a psychologist."
1681,An American filmmaker and cyclist unwittingly wades into a global scandal when a Russian scientist leaks shocking details of a vast doping conspiracy.
1688,"Young Laura and Carlos experience the intensity and fragility of first love, as life realities gradually tarnish their idealized notions of romance."
1689,"Young Laura and Carlos experience the intensity and fragility of first love, as life realities gradually tarnish their idealized notions of romance."
1693,"After losing her family in a suspicious car crash, a woman awakens from a 13-year coma determined to expose the truth about the long-ago tragedy."
1698,"Two doctors with opposite approaches to treating patients clash on the job and must learn to trust each other's expertise, allowing love to bloom."
1699,"When his brother becomes involved in a deadly bank robbery, a heartbroken cop vows to track down and retrieve his wayward sibling – dead or alive."
1703,"After a one-night stand, Holly develops a dangerous obsession with Tyler and transfers to his high school, desperate to keep their ""romance"" alive."
1715,"When a fashion blogger falls for a video game vlogger, their romance goes viral. But separating their virtual life from reality gets complicated."
1718,"To better himself, a spoiled prince temporarily assumes a commoner’s identity. But he soon learns his palace has been gifted to his father’s new wife."
1723,"When the black sheep son of a respected family threatens to expose dark secrets from their past, sibling loyalties are put to the test."
1725,"When the black sheep son of a respected family threatens to expose dark secrets from their past, sibling loyalties are put to the test."
1726,"When the black sheep son of a respected family threatens to expose dark secrets from their past, sibling loyalties are put to the test."
1728,"After street smart kid Raees rises to become Gujarat's bootlegging king in the 1980s, he tries to balance his life of crime with helping his people."
1739,"When his new love is captured by an evil snake charmer, a young cobra and his scorpion best friend set out across the desert on a wild rescue mission."
1742,"In Singapore, a homeless ex-convict hoping to reunite with his family forms a bond with a Chinese sex worker while serving as her bodyguard."
1749,Teen witch Bibi and horse-loving Tina face trouble when a posh girl flirts with Tina's boyfriend and a crook sets his greedy eyes on a promising foal.
1751,"Teen father-to-be Sam imagines his future as a young parent and finds a surprising mentor while reading about his idol, pro skateboarder Tony Hawk."
1753,"As their big day arrives, a couple's lavish wedding plans turn into a nightmare of exes, fighting parents and uninvited guests."
1754,"As their big day arrives, a couple's lavish wedding plans turn into a nightmare of exes, fighting parents and uninvited guests."
1755,"As their big day arrives, a couple's lavish wedding plans turn into a nightmare of exes, fighting parents and uninvited guests."
1757,"When a hapless but dedicated talent manager signs his first client who actually has talent, his career finally starts to take off."
1759,A famous designer who's always pretended to be gay finds himself in crisis mode when threatened with exposure as the woman-chasing straight guy he is.
1760,A freshman uninterested in joining a fraternity is convinced to pledge by a rich roommate who introduces him to a world darker than he ever dreamed.
1761,"Assigned to go undercover to take down an impenetrable crime ring, a detective finds himself falling under the sway of its enigmatic leader."
1764,"Journalist Naresh is hired to probe illegal activities on an island. When he's captured, a fellow prisoner gives him a ring with magic powers."
1765,"After his wife dies in a car accident, a grief-stricken man visits his estranged mother-in-law in Maine, where they try to help each other heal."
1768,"Deformed, disfigured characters must find a way to deal with society shunning their differences in this darkly comic social drama."
1778,"During Carnival, two teens from different classes meet years after being kept apart. Bad decisions lead the boy to hide with the girl inside a float."
1782,"A young couple falls in love, but conflicting loyalties drive them apart. Years later, fate intervenes and hands them a second chance."
1786,"A single mother, her boyfriend and her 8-year-old son take a weeklong resort vacation, during which secrets and relationship strains take their toll."
1789,"A sexual assault victim, unjustly tried for the attempted murder of her attacker, is defended by a retired lawyer who challenges India's rape culture."
1790,"A sexual assault victim, unjustly tried for the attempted murder of her attacker, is defended by a retired lawyer who challenges India's rape culture."
1794,A psychiatrist is plagued by flashbacks to a terrifying attack as she treats a new patient who was horribly disfigured in an accident.
1795,"Lone-wolf vigilante Bill Williamson is back, taking aim at the U.S. government and eluding the pursuit of two FBI agents who are on his trail."
1802,"This family-oriented retelling of the King Arthur legend finds Merlin arriving in Camelot, where he hones his magic skills with the help of his uncle."
1806,"This documentary series reconstructs history's most complex, high-stakes hostage negotiations as kidnapping victims recount their terrifying ordeals."
1810,"Two former high school sweethearts unexpectedly reunite in their old hometown, where they rediscover their magical bond and face a shared regret."
1816,Two brothers clash with their half-siblings when a visit home to see their dying mother surfaces old secrets and becomes a fight for survival.
1817,Two brothers clash with their half-siblings when a visit home to see their dying mother surfaces old secrets and becomes a fight for survival.
1820,"When a woman is brutally murdered on a playground, a group of detectives find themselves drawn into a dark conspiracy as they search for the killer."
1821,"When a woman is brutally murdered on a playground, a group of detectives find themselves drawn into a dark conspiracy as they search for the killer."
1824,"When a ferocious contagion sweeps through Atlanta, authorities impose a precarious quarantine on the city while scrambling to find a cure."
1826,"A passionate pianist and a soulful puzzle maker who treasures silence aren't the best neighbors, but things get interesting when they start to date."
1832,"In 1985, when a vessel protesting nuclear testing is sunk in New Zealand, local police fight to prove it was a terrorist plot by their French allies."
1839,"Skeptics and others discuss widely held conspiracy theories involving aliens, government cover-ups, secret assassinations and other intrigues."
1840,"Skeptics and others discuss widely held conspiracy theories involving aliens, government cover-ups, secret assassinations and other intrigues."
1845,"Long-lost buddy Zack gets suburban dad Kyle on a bus to a Rebirth seminar, sending him down a rabbit hole of psychodrama, seduction and violence."
1846,"Long-lost buddy Zack gets suburban dad Kyle on a bus to a Rebirth seminar, sending him down a rabbit hole of psychodrama, seduction and violence."
1854,"In Justin's dreams, he and his imaginary friends Olive and Squidgy travel around the world learning about nature and other cultures."
1859,Mike Epps tears up the stage at L.A.'s historic Orpheum Theatre in a special packed with blistering impressions and unapologetically raunchy swagger.
1860,"When his outlaw dad is kidnapped, Tommy “White Knife” Stockburn sets off across the West on a rescue mission with five brothers he never knew he had."
1862,"After an ugly divorce, a wealthy but unhappy man trains at a local gym and develops a strange relationship with the owner and a captivating trainer."
1864,"When a group of strangers is seized and awaits execution, they face the impossible task of choosing the one person among them worthy of being spared."
1877,"When a doctor goes missing, his psychiatrist wife treats the bizarre medical condition of a psychic patient, who knows much more than he's leading on."
1882,"Upping the “13 Cameras” ante, this sequel finds a family renting a vacation house that’s been customized to violate their privacy."
1884,"Student filmmakers uncover occult rituals tied to an abandoned warehouse, then gradually realize the horror is closer than they think."
1885,"In the frozen tundra of a futuristic Arizona where humans have been forced underground, a soldier hunts the bioengineered leader of a rebellion."
1891,"Six friends decide to undertake a grueling mountain trek, only to find that the difficulties in store for them are not merely physical."
1895,The filmmaker hunts for the missing puzzle pieces of his family history during a visit with a complex and controversial figure: his grandmother.
1896,A timid man gets unexpected superpowers while trying to save his family's land and a sacred tree from a ruthless tycoon.
1897,"When his girlfriend walks out and leaves him a wreck, a graphic designer – who seemed to have it all – sets out to discover where he went wrong."
1900,"Nina thinks her husband, James, is cheating on her, and she sets out to prove it by calling him and pretending to be another woman."
1901,"A film school graduate is interested in making a movie about his girlfriend's uncle, who claims that he can see his long-dead daughter."
1905,"Years after their father disappears, Meg and her younger brother Charles Wallace cross galaxies on a quest to save him from the heart of darkness."
1906,"After losing her mother, a teenage girl bonds with her phone’s artificial intelligence app, a relationship that soon takes a dark and violent turn."
1912,A disenfranchised 16-year-old girl connects to an older man on the internet and after a brief one-sided affair descends into obsession and anorexia.
1913,"Three lifelong friends travel to Acapulco ostensibly so one of them can find his lost love, but the real reason behind the trip holds some surprises."
1916,"When his future sister-in-law is kidnapped by human traffickers, a military veteran joins forces with his brothers and a world-weary cop to rescue her."
1917,"This five-part nature series chronicles fascinating stories of survival on the African continent, home to the most diverse animal life on the planet."
1919,"An American tourist and his friends are partying in Chile, but a major earthquake devastates the area and forces them to scramble for survival."
1921,"An American tourist and his friends are partying in Chile, but a major earthquake devastates the area and forces them to scramble for survival."
1927,"Instead of summoning the spirit of her dearly departed mother, a charming teen accidentally awakens a vengeful witch who wants to destroy her town."
1928,"A horror novelist with a traumatic past returns to her childhood hometown, where she revisits her night terrors and loses sight of reality."
1942,Rare home videos and interviews with Amy Winehouse's inner circle offer an intimate look at her journey from charismatic teen to troubled star.
1946,"When a violent assault leaves her vulnerable, a streetwise Chicago cop receives help from a haunted loner who's struggling with traumas of his own."
1951,A tough-as-nails treasure hunter protects a humanitarian doctor as she tries to cure a supernatural disease caused by a mysterious witch.
1954,"This sci-fi thriller suggests that Apollo 17, despite official statements to the contrary, wasn't NASA's last manned mission to the moon."
1962,"When an American couple vacationing in Morocco falls victim to a random act of violence, a series of events unfolds across four countries."
1965,"When two would-be robbers accidentally kill a made man, they find themselves on the run from the South Philly Italian mob."
1983,Four friends from a humble technical school compete against the elite students of a prestigious university in a robot-building contest.
1991,"After having her heart broken by a man who seduced her at a party, a young, ambitious woman concocts a scheme to get revenge."
1994,"Set in the Grey City, this ""Cities of Love"" installment is a star-studded, 10-story collection of redemptive love, crushing loss and everyday romances."
2001,The alcohol-fueled high jinks of a bachelor party go haywire when the buddies of an ill-fated groom abduct his fiancée's new lover.
2005,"Inspired by classic and contemporary literature, four renowned Marathi directors create four individual stories in this anthology of short films."
2007,"Cracking under the demands of children and a philandering, thankless husband, an overworked suburban mother assumes the persona of a ferocious dog."
2009,"When a small-town wedding videographer falls in love, he decides he needs to make more money and turns to shooting sexy videos – with mixed results."
2011,"After discovering that their secret military prison is under attack by terrorists, a ragtag group of inmates does their best to neutralize the enemy."
2014,"Dumped over a video he made to amuse his ailing dad, a heartsick Jérémy hatches an elaborate scheme to win back his superhero-loving girlfriend, Lola."
2023,"Raj, the son of strict, wealthy parents, falls in love with Bobby, the daughter of a poor Christian fisherman – a romance his parents oppose."
2025,"After learning they are the sole survivors of an eerie apocalypse, a young American couple on vacation in Iceland ponder their love and the future."
2027,"Following a fashion show mishap, three supermodels find themselves on the run from dangerous gangsters trying to recover a fortune in stolen diamonds."
2033,"After 12 years in the minors, a struggling baseball player retires, returns home and faces the last person he struck out with – his ex-girlfriend."
2038,"When four college friends reunite for a bachelor party, their hunt for cash said to be hidden in Kentucky's backwoods leads to bloodshed and betrayal."
2040,"When their diverse neighborhood is besieged by a mysterious militia, a grad student and an ex-Marine become an unlikely team in a battle for survival."
2043,"As a flesh-eating virus rips its way through a remote woodland cabin, the terrified teens vacationing inside wonder who'll fall victim next."
2047,Five calendar models try to navigate the twists and turns thrown in their path by the seductive and ruthless world of glamour.
2055,"When a secretary saves her tycoon boss's life, his family hears wedding bells. Problem is, she's already in love – with his younger brother."
2059,"When a wealthy patriarch unexpectedly drops dead, his money-crazed family, friends and staff scramble for his billionaire fortune."
2061,A career woman who has everything but romance finds her values challenged when she starts dating a good man she met on a Christian matchmaking site.
2069,Overworked Michael Newman stumbles on a universal remote control that gives him the power to pause or fast-forward through scenes in his life.
2074,Low TV ratings drive a well-known journalist to concoct a plan to interview a notorious underworld figure who is also a suspected terrorist.
2078,"Lured to a majestic, remote villa by an old lover, an erotic novelist finds herself falling for a mysterious woman and descending into a moral abyss."
2080,"Following the death of his wife and daughter in a terrorist attack, an ex-Indian army commando agrees to infiltrate a terrorist cell."
2084,"Maya finally hooks up with her online dream girl, only to discover she’s deeply involved with an older sugar daddy – a man Maya knows all too well."
