,description_x
716,"When his jealous sister plots to wreck his engagement, a young man does everything he can to protect his betrothed from her devious schemes."
719,"When a town suffers an economic collapse, social unrest forces a family to seek refuge in the wilderness as bitter outlaws threaten their survival."
723,"After 20 years abroad, a photographer returns to his birth country of Egypt and gets stranded without identification in a now unfamiliar culture."
729,The speech-and-hearing-impaired heiress of a palatial mansion must rely on basic instincts when a masked invader is determined to kill her.
730,"While trying to make their teacher fall for a basketball coach, four misfits and a model student find friendship, love and the courage to be themselves."
736,"When his frustrated girlfriend decides to leave him, a struggling writer gets down to work on stories of romance he hopes will win her back."
742,"Implicated in her daughter's disappearance, a mother searches for answers when she returns to an old family home that may have an unwanted visitor."
743,An inept Detroit cop must team up with his girlfriend's foul-mouthed young son when their first crack at bonding time uncovers a criminal conspiracy.
750,"When his degree is found bogus, lawyer Jeff Winger is sent back to college, where he meets students and teachers with credentials as dubious as his."
759,"Trapped in a national park, a tiger expert and a group of hunters turn to an enigmatic local for help when they mysteriously begin to die one by one."
769,An elite international squad of uniquely skilled special forces is assembled to combat a rising underground terrorist threat in the Middle East.
775,An undercover assignment to expose a drug ring becomes a timid Mumbai constable’s road to empowerment as she realizes her dormant sexuality's potential.
776,An undercover assignment to expose a drug ring becomes a timid Mumbai constable’s road to empowerment as she realizes her dormant sexuality's potential.
780,"Stranded when the Earth is suddenly destroyed in a mysterious cataclysm, the astronauts aboard a marooned space station slowly lose their minds."
784,"Sick of keeping their love a secret from their constantly bickering mothers, a young couple seeks to uncover the cause of the women’s longstanding war."
788,"When a college heartthrob is accused of rape by a less popular student, his girlfriend navigates various versions of the story in search of the truth."
792,"42-year-old Viorel, a distraught engineer, takes drastic measures to end his emotional suffering after enduring a devastating divorce."
797,"42-year-old Viorel, a distraught engineer, takes drastic measures to end his emotional suffering after enduring a devastating divorce."
804,"When an aspiring actress hits it big thanks to a candid Instagram post, the lives of several Tokyo women cross as they struggle to define happiness IRL."
810,"Fed up with coordinating weddings for everyone else, unlucky-in-love event planner Mo turns to the internet to see if she can find her own Mr. Right."
815,"Troubled by the state of their marriage, Vanessa and Roland visit a French seaside town, where they have a fateful encounter with a pair of newlyweds."
817,"A young woman conducts a search for her twin sister, who disappeared in a notorious area of Japan known as the Suicide Forest."
819,"A young woman conducts a search for her twin sister, who disappeared in a notorious area of Japan known as the Suicide Forest."
827,A teen's discovery of a vintage Polaroid camera develops into a darker tale when she finds that whoever takes their photo with it dies soon afterward.
835,A case of writer’s block inspires a young novelist to return home to New York City and reconnect with his engaged ex and his bohemian parents.
837,"A U.S. Marshal arrives at a small town in Nevada, only to learn that his preacher brother is dead after standing up to the town's mayor and outlaws."
839,"Trying to uphold justice in a lawless future, a D.A. is slain by cyberpunks but a supernatural twist sends his car on a bloody quest for revenge."
840,"A young man who gets tongue-tied around women writes a love letter to his crush, but it ends up in the hands of her mother, who thinks it's for her."
844,An inexperienced murder detective joins a desperate search for a deranged serial killer who possesses a deep obsession with young women’s skin.
845,"When Ana, an influencer, crashes her car while talking on the phone, she’s shipped to her grumpy grandfather's farm – and forced into a digital detox."
847,Three prosperous women – including a mother and her daughter – fall for a seductive man in Colombia's Coffee Triangle.
849,"A group of uber-popular, social media influencers’ trip to a digital media festival grows dark when an evil spirit wants to lure them to their demise."
854,Identical twins and notorious gangsters Reggie and Ronnie Kray elude the authorities in 1960s London while transfixing and terrifying the public.
859,"Brilliant young students discover a breakthrough that could change humankind, but soon find themselves the subjects of a much bigger experiment."
863,An American platoon stationed in the Middle East is thrust into battle with a breed of tentacled aliens whose rapid spread threatens human survival.
864,A special agent abruptly reunites with a criminal – once a former friend – when he attempts to use his identity to infiltrate and take down a cartel.
867,"Small-town Madhav falls for big-city Riya and wants her to be his girlfriend. But she views their relationship differently, and suggests a compromise."
868,Bank chairman Charles Bunbury – who knows next to nothing about banking – fights to save both his company and his marriage from disaster.
869,"The directors of Emmy-nominated ""Lust Stories"" (Zoya Akhtar, Anurag Kashyap, Dibakar Banerjee and Karan Johar) reunite for this quartet of thrillers."
872,"Seeking vengeance for the murder of his wife, a cop robs a bank in order to be thrown into prison with the Russian kingpin who ruined his life."
875,A rookie lawyer with an emasculating past in baseball can break into the legal world only if he manages a law firm's ragtag company softball team.
876,"In the near future, Russia initiates a ""silk glove"" invasion of Norway to restart oil production, but soon uncertainty, chaos and danger erupt."
877,"A quiet teen's life is shaken up when she's forced to be her arrogant neighbor's slave. He loves her, but they both have a lot to learn about trust."
878,"While in Rome to shoot his first movie, actor and industrial heir Nick becomes obsessed with a dating app that sends him into a self-destructive spiral."
880,"Middle schooler Nazuna desperately wants to run away with her classmate Norimichi, who somehow turns back time on this fateful summer's day."
882,A frustrated novelist with money problems opens an unsanctioned senior center at his house to make quick cash and occupy his cumbersome father-in-law.
884,"After crash-landing on an alien planet, the Robinson family fights against all odds to survive and escape. But they're surrounded by hidden dangers."
885,"After being reunited with a brother he thought was killed in combat, a former army medic begins to experience violent, paranoid visions."
889,An online community of amateur sleuths use technology to solve crimes – and make quirky friends – in their quest for justice.
890,An online community of amateur sleuths use technology to solve crimes – and make quirky friends – in their quest for justice.
894,"Sent on the same deadly international mission by their rival religious factions, two men's madcap antics along the way take them hilariously off course."
910,A divorced couple decides to continue sharing a home but their already-delicate cohabiting scheme unravels when they begin dating other people.
921,"Determined to bring a Zika vaccine to the remote Pantanal, three doctors clash with a faith healer and are pulled deeper into the mysteries of his cult."
926,A get-rich-quick scheme goes awry when a group of friends stumbles onto a dangerous conspiracy and wind up getting mistaken for the bad guys.
929,"A goofy copywriter unwittingly convinces the Indian cricket team that she’s their lucky mascot, to the dismay of their superstition-shunning captain."
934,"In this action-packed drama based on an extraordinary true story, four brothers protect more than 1,000 Jewish refugees during World War II."
939,"Aspiring to fulfill his father’s dream and become a civil services officer, a young man loses his way upon becoming entangled with a criminal lynchpin."
944,"Determined to save an Amazon tribe being squeezed by logging, a group of students finds nothing but trouble when their plane crashes in the jungle."
947,A world-weary man’s self-imposed home confinement becomes a comedy of errors with the simultaneous arrivals of a peculiar package and a curious journalist.
951,"Mehdi gets out of prison, planning to settle old scores. But first, he must reconnect with his gang, now living in an idyllic beach resort in Thailand."
955,"As three kingdoms struggle for control of a walled city, a figure with a rare power spins a web of intrigue that entangles a king's court."
956,"On the verge of divorce, a middle-aged couple, each involved in a serious affair, rethink their marriage and the meaning of love and fidelity."
957,"When a beloved secret agent falls deep into a coma, his bumbling brother must defend their community from a divisive political threat."
965,"A notorious thief allies with a street racer for a grand heist involving an elaborate game of deceit with authorities, who have their own dirty secrets."
966,"Home for the holidays, a broke puppeteer knows there’s treasure buried somewhere under her town. To find it, all she has to do is die – almost."
967,"Fleeing the family business and an arranged marriage, Santa’s daughter chooses a magical adventure of her own: College."
971,"Two nefarious schemes taking place 10 years apart entangle a dauntless triad member, who must break out of prison to rescue a loved one."
976,"An honest lawyer reaches a moral crossroads after the cops force her to inform on her incarcerated brother, the leader of a rising criminal faction."
977,Secrets bubble to the surface after a sensual encounter and an unforeseen crime entangle two friends and a woman caught between them.
979,"Living his best life in post-apocalyptic LA, a slacker strives to find the girl of his dreams while outwitting mindless ghouls and cliquish gangs."
982,A wedding in a Malaysian village leaves out one guest: a scorned vampire ghost bent on settling a secret score with the groom and anyone in her way.
984,"With his desperate parents in tow, an 11-year-old boy with a debilitating illness checks into an isolated clinic to undergo experimental therapy."
989,"A single mother and her twin sons move into a rural house, unaware of its history of being inhabited by an evil spirit that preys upon young children."
990,"After his wife and injured daughter disappear from an ER, a man conducts a panicked search and becomes convinced the hospital is hiding something."
991,"After his wife and injured daughter disappear from an ER, a man conducts a panicked search and becomes convinced the hospital is hiding something."
1003,A starry-eyed employee of a hot cosmetics company hires a dreamy photographer who is secretly indebted to a major rival – her sketchy aunt.
1005,"While chasing her dream of becoming a chef, Zeliha cooks up trouble in the kitchen with her wild, kooky and unsuspecting ways."
1010,"Under pressure to marry, a perennial bachelor hires a much younger woman to act as his fiancée, but her bond with his family throws his plan for a loop."
1011,An American man in the midst of a mid-life crisis travels to the French countryside to find a new lease on life.
1015,"After years of slouching through life, 6-foot-1 teen Jodi resolves to conquer her insecurities and gets caught up in a high school love triangle."
1026,"Based on the speculative short stories of MirrorFiction, this sci-fi thriller anthology plunges headlong into our deepest desires – and darkest fears."
1028,Four friends shake up their lives when they meet a new woman in their apartment complex who encourages them to embrace their wild sides.
1030,"Reinstated to eradicate the worst crimes in the city, a detective requests the release of three convicts to enlist their help in catching the felons."
1031,"Reinstated to eradicate the worst crimes in the city, a detective requests the release of three convicts to enlist their help in catching the felons."
1034,"After living in America for years, a teenage girl moves back to the Netherlands and is quickly singled out as a misfit by the popular clique at school."
1037,A young chauffeur who's at a crossroads in his life escorts a pair of clients around Barcelona and becomes embroiled in their mysterious quest.
1038,"When a student's suicide rattles an all-girls Catholic school, a clairvoyant guidance counselor leans on a ghost to uncover the convent's abusive past."
1041,"When her estranged mother suddenly dies, a woman must follow the quirky instructions laid out in the will in order to collect an important inheritance."
1042,"When Jennifer wakes up with amnesia after a traumatic attack, her doting husband cares for her. But she soon realizes the danger is far from over."
1062,"On a field trip to Petra, two jinns – one good, the other evil – enter the human realm, turning high school into a supernatural battleground."
1070,"This documentary follows the life of Clarence Avant, the ultimate, uncensored mentor and behind-the-scenes rainmaker in music, film, TV and politics."
1073,Awkward 16-year-old Andrei is infatuated with his alluring but aloof schoolmate Ramona – until he meets stunning hotel clerk Anemona while on vacation.
1074,"Raised in a boxing gym, two orphaned brothers become highly skilled martial artists and must combat threats in the streets and the ring."
1076,"This sprawling crime drama follows the true story of the Rizzuto family and its associates, who presided over organized crime in Montreal for decades."
1077,"This sprawling crime drama follows the true story of the Rizzuto family and its associates, who presided over organized crime in Montreal for decades."
1085,"Stranded at a summer camp when aliens attack the planet, four teens with nothing in common embark on a perilous mission to save the world."
1089,"An ex-assassin tries to leave her dark past behind until a power-hungry gang targets her and her family, forcing her to summon her killer instincts."
1090,"As two teen prodigies try to master the art of time travel, a tragic police shooting sends them on a series of dangerous trips to the past."
1094,"When a long list of shenanigans lands Tyler in hot water, he’s forced to suit up and spend his summer training for an elite junior lifeguard program."
1098,"When longtime friends meet up for a wine-soaked birthday getaway in Napa Valley, their perfectly planned weekend turns messier by the minute."
1099,"A commercial diver becomes trapped on the ocean floor with dwindling oxygen and little hope of a timely rescue, so he tries to save himself."
1110,"Still a virgin at 32 years old, a frustrated advertising agent gets the shock of his life when an unlikely chain of events turns him into a porn star."
1114,"When a prank goes wrong, a shy kid from Compton is sent away for murder. Four years later, he’s back and out for revenge on homecoming weekend."
1118,"With the world under attack by deadly creatures who hunt by sound, a teen and her family seek refuge outside the city and encounter a mysterious cult."
1119,The U.S. Navy Seal team tackles a top-secret mission at a research center where scientists have mysteriously disappeared and another life form awaits.
1121,"After a tragedy at a school sends shock waves through a wealthy Stockholm suburb, a seemingly well-adjusted teen finds herself on trial for murder."
1131,A man returns home to Atlanta to try and turn around his family's struggling restaurant with the help of a new chicken recipe.
1133,"Fifteen years after a traumatic crime, a woman is released from psychiatric care and tries to drive out an evil spirit that continues to haunt her."
1144,"A space-time continuum glitch allows Vera to save a boy's life 25 years earlier, but results in the loss of her daughter, whom she fights to get back."
1147,"Now a celebrity, Benjie is tasked with taking care of a General's young son, who has information about a looming terrorist threat."
1148,"Following his best friend's death, Arci takes charge of her two boisterous children with some help from their gang-affiliated uncle."
1151,"A PR agent trying to find her stolen phone, a politician in trouble, and a fading celebrity find their lives intertwining in unexpected, messy ways."
1161,"A university lecturer in Russia returns to Egypt after her husband's sudden disappearance, uncovering further mysteries the more she investigates."
1172,"After learning his brother died on a mission in Romania, a former soldier teams up with two allies to hunt down a mysterious enemy and exact revenge."
1178,"Two best friends put their careers and marriages on the line when they launch a business hosting outrageous, anything-goes bachelor parties in Hungary."
1192,Powerlifter Matt Kroczaleski faced his greatest challenge when he came out as transgender. This documentary captures his transition into a woman.
1204,"Everyday guy Kabir is thrown for a loop when he meets Kuhu, a freewheeling party girl. Now, he's a changed man, dancing, running half-naked through the streets and donning ladies' shoes at her whim."
1208,The police officers at South Korea's busiest patrol division toil day and night as keepers of law and peace – but the reality is far from orderly.
1212,"A family’s tense reunion turns terrifying when they get trapped in their home by an unknown force, and sinister commands begin appearing on their TV."
1223,"A deputy curator of a chaebol-funded art gallery and her husband, a politically ambitious economics professor, will do anything to join the über-elite."
1230,"A night market vendor clashes with a lofty celebrity chef in a culinary challenge, fueling the first sparks of a romance."
1235,"Before one of them moves to the U.S., two childhood friends promise to reunite as adults. But illness and the vagaries of the heart stand in the way."
1241,"Eerie things begin to happen after a man gives his wife a doll, unaware it once belonged to a girl who was murdered. The first of the ""Doll"" films."
1245,"Two strangers meet on a dating app and experience instant chemistry, but their relationship unravels as jarring differences catch up to them."
1246,"In a remote area of the Canary Islands, a surfer falls off a cliff. Fighting to survive, he reflects on his life and past romance. Based on true events."
1249,"In a remote area of the Canary Islands, a surfer falls off a cliff. Fighting to survive, he reflects on his life and past romance. Based on true events."
1252,"In a remote area of the Canary Islands, a surfer falls off a cliff. Fighting to survive, he reflects on his life and past romance. Based on true events."
1253,"Clashing views on intimacy lead a couple to go their separate ways to reflect on commitment and companionship, before suddenly crossing paths again."
1265,"Troubled by his past, a scam artist who runs a petty racket with his adoptive mom finds redemption while mentoring a group of difficult students."
1270,"When an army recruit is found dead, his fellow soldiers are forced to confront a terrifying secret that's haunting their jungle island training camp."
1271,"After seducing a philandering con man, a rebellious young woman enlists his help in carrying out a heinous crime against her sister."
1272,"Entangling the lives of a movie star, a chauffeur, a prostitute and a pimp, this bold drama reveals ugly truths beneath Mumbai’s glitzy veneer."
1276,"Venturing into the woods, high schooler James discovers an intelligent robot that he must save from the hands of a businessman with an evil scheme."
1281,"After meeting under awkward circumstances, a glamorous businesswoman and a tradition-bound policeman begin a relationship that changes their lives."
1284,A contract killer skilled at staging lethal accidents fears he may be a victim of his own strategy when an accomplice dies in a mysterious mishap.
1285,"After Amalie's dad goes bankrupt, the young dancer's affluent life collapses. But she finds a new beat to follow after meeting hip-hop dancer Mikael."
1296,"An executive-turned-viral sensation loses his reputation and his memory, but finds a new life with his biological mother and her empowered dance group."
1297,"A new pack of Pup Star pooches stumbles upon a rival team’s plan to ruin Christmas, then ends up at the North Pole to try and save the holiday spirit."
1300,A toy manufacturer and his wife are terrorized by a demon after their orphaned niece tries to summon her late mother's spirit using a spooky ritual.
1301,"Trapped in an empty building, nine people are forced to play a lethal game. All their movements will be recorded, and only one player can survive."
1302,"Trapped in an empty building, nine people are forced to play a lethal game. All their movements will be recorded, and only one player can survive."
1310,A war veteran plagued by guilt over his final mission teams up with his best friend's widow to infiltrate a dangerous Copenhagen biker gang.
1315,"A cop full of self-doubt loses his gun five days before he's due to leave the force, and becomes an unexpected hero as he tries to retrieve it."
1320,"Having risen from humble beginnings, an ambitious young man sets his sights on winning a major dance competition that could catapult him to fame."
1322,"In a last-ditch effort, the jaded coach of the Southall United Football Club assembles a ragtag team and helps lead the team to a comeback season."
1325,"During a wilderness getaway, a gang of sociopathic criminals kidnap a woman and assault her husband, who must summon all his strength to save her."
1328,Stories of personal victories coincide with Team India's battle for the Cricket World Cup in this engaging ensemble drama.
1330,One woman experiences the dramatic highs and lows of fame in this voyeuristic glimpse past the glitz and glamour of a Bollywood superstar's life.
1331,A young man returns to his native village on a mission of vengeance after his father commits suicide in the wake of false accusations.
1332,A young man returns to his native village on a mission of vengeance after his father commits suicide in the wake of false accusations.
1333,"Three professional friends, all husbands living with domineering wives, take a well-deserved vacation in the resort city of Goa."
1336,"After falling in love during college, architect Maddy and free spirit Payal have five wonderful years together, until a mystery suddenly divides them."
1343,"Asked to deliver a package for a friend, Madhu gets her fiancé, Jayaganthan, to take care of it, and he then passes the task to one of his roommates."
1346,"A poor family’s goat suddenly acquires divine status, sparking a widespread frenzy as everyone clamors to benefit from its unexpected celebrity."
1354,"When the lives of a carefree boxer and his cabdriver dad collide with the ambitions of a ruthless businessman, a search for answers turns to revenge."
1358,Five youngsters discover that an antique mirror found in their orphanage is home to an evil ghost who kidnaps children and imprisons them inside it.
1360,"A brother-sister team who fake paranormal encounters for cash get more than they bargained for when a job at a haunted estate turns very, very real."
1365,"A game of ""Truth or Dare"" among college friends on spring break turns deadly when a demon seems determined to use it to kill them all."
1366,"Beatrix can't wait to be inducted as a witch, but an unfortunate incident threatens to take her pending title away if she doesn't act fast."
1367,A film crew shooting in a remote forested location begins losing members one by one to a mysterious entity that they cannot see or hear.
1386,A martial arts specialist accidentally becomes a superhero when he steps in – in costume – to help the cops catch a criminal.
1392,"A teenage boy becomes smitten with his new drama teacher and pursues her, despite the perilous risks of being found out."
1394,India's primary intelligence agency sends an enigmatic operative on a top-secret mission to avenge the 11/26 terrorist attack on Mumbai.
1402,"In this sequel set in the world of horse racing, half-brothers Ranvir and Rajiv Singh return for another complex tale of love, greed and violence."
1406,"Upon returning to his industrial hometown, a young man must decide whether to follow his own dreams or acquiesce to his father's plans for his future."
1412,"In the grim Alaskan winter, a naturalist hunts for wolves blamed for killing a local boy, but he soon finds himself swept into a chilling mystery."
1414,Two struggling strangers connect during a mind-bending pharmaceutical trial involving a doctor with mother issues and an emotionally complex computer.
1424,The lives of a fundamentalist online troll and a woman reeling from a sex tape gone viral become dangerously intertwined in this provocative thriller.
1427,Her dad's deathbed confession leads Julia to discover she has more than 100 brothers and two sisters: troubled TV star Roxy and uptight lawyer Edie.
1435,"After her stepdaughter is sexually assaulted at a party, a furious mother sets out to destroy the lives of the four perpetrators who walked away free."
1439,"After their buddy suffers an unfortunate accident during spring break, four pals risk everything – including their dignity – to make him whole again."
