,description_x
0,"The arrival of a charismatic young priest brings glorious miracles, ominous mysteries and renewed religious fervor to a dying town desperate to believe."
6,"Blackmailed by his company's CEO, a low-level employee finds himself forced to spy on the boss's rival and former mentor."
12,A hiking trip into the wild turns into a desperate bid for survival for five friends on the run from a mysterious shooter.
13,A hiking trip into the wild turns into a desperate bid for survival for five friends on the run from a mysterious shooter.
17,"Status and strategy collide in this social experiment and competition show where online players flirt, befriend and catfish their way toward $100,000."
18,"Status and strategy collide in this social experiment and competition show where online players flirt, befriend and catfish their way toward $100,000."
25,"After embarking on an affair with the cop probing the murder of a young woman, an insular schoolteacher suspects her lover was involved in the crime."
26,A couple must strive to remain resilient after regional hostilities drive them from their beloved home into a refugee camp.
30,"When a retired CIA agent is kidnapped, his son, a government analyst, embarks on an unauthorized mission to find him and halt a terrorist plot."
31,"When a retired CIA agent is kidnapped, his son, a government analyst, embarks on an unauthorized mission to find him and halt a terrorist plot."
34,"After Kid gets engaged, Play plans to throw the biggest bachelor party ever. But every celebration for these two always comes with complications."
37,"In Jim Henson's fantasy, teen Sarah embarks on a life-altering quest to rescue her little brother from the clutches of a treacherous goblin."
49,A multimillionaire fakes his death and forces his relatives to live together in his mansion for one year to see who's worthy of inheriting his fortune.
50,A bank hires an enigmatic and unorthodox debt collector to recover money from four borrowers who are unable to pay their loans.
52,"A student tries to steal a test from a teacher's home, leaving him for dead after an accident. A string of murders may be the professor's revenge."
54,"When an unlikely porn actor falls for a woman outside the industry, he employs his co-stars as a stand-in traditional family to impress her father."
55,An aspiring actor and a struggling DJ team up to pursue the ladies they love and a diamond that rightfully belongs to their oversexed dog.
56,The life and career of a lawyer are thrown into chaos when his son's wish magically renders him incapable of telling a lie.
59,"This turbulent sequel to Once Upon a Time in Mumbai carries on the saga of the gangland don Shoaib Khan, who continues pressing for more control."
60,A couple out to have a sensuous weekend at a house outside of Mumbai finds it rigged with surveillance cameras and occupied by an evil entity.
61,The horror continues when Ragini's video goes viral and a sleazy director decides to make a movie about the incident in the original house.
67,"At a major university, the first woman of color to become chair tries to meet the dizzying demands and high expectations of a failing English department."
68,"At a major university, the first woman of color to become chair tries to meet the dizzying demands and high expectations of a failing English department."
78,"Desperate to save their marriage, a young couple takes a deal and moves into their dream home, but disturbing events reveal the house's troubled history."
80,"Desperate to save their marriage, a young couple takes a deal and moves into their dream home, but disturbing events reveal the house's troubled history."
82,This deftly animated take on a legendary Old English epic tells the timeless tale of a Scandinavian hero who's known for slaying dragons.
92,A genius engineer and his crew of amateur thieves plot a scheme to seize a legendary lost treasure hidden in a fortress beneath the Bank of Spain.
94,"Two cops form a task force to take down two mobsters, but when a sinister politician enters the picture, dubious loyalties and motives come to light."
95,"Working as a Mossad spy assigned to Tehran, Rachel reaches her breaking point. Now it’s dangerously hard to tell whose side she’s on."
96,"In the wake of a zombie apocalypse, survivors hold on to the hope of humanity by banding together to wage a fight for their own survival."
98,"Separated as children, three cousins with an unshakeable bond confront their painful pasts and embark on an emotional journey to find each other."
100,"With a bloodthirsty enemy on a quest for revenge, Bella must reconcile her love for vampire Edward and her growing feelings for werewolf Jacob."
101,"Still reeling from the departure of vampire Edward Cullen, a heartbroken Bella Swan finds comfort in her friendship with werewolf Jacob Black."
106,"In rural Pennsylvania, a working-class single mom must pick up the pieces and step up to raise her grandson after her daughter suddenly disappears."
116,"After a mysterious disease kills every resident over 22 years old, survivors of a town must fend for themselves when the government quarantines them."
117,"Rachel shocks her proper British parents when she marries an American hippie, but it's just the first in a series of surprises for the family."
119,"A mysterious, clever girl named Nanno transfers to different schools, exposing the lies and misdeeds of the students and faculty at every turn."
120,"In this new TV series sequel to the classic horror franchise, a cyberbullying incident in Lakewood leads to a murder with chilling echoes of the past."
123,Undercover agents infiltrate a drug kingpin's operation by posing as a couple at the campground where he spends his weekends. Inspired by real events.
129,A tight-knit trio of specially trained agents wield weapons — and charm — as they track down stolen software in this reboot of the classic TV series.
131,"Eight people, some with ulterior motives, go on an expedition to the Congo, where they find a lost city protected by killer apes."
141,"When a snow day shuts down the whole town, the Wheeler family cuts loose. Hal makes a play for the most popular girl in his school, 10-year-old Natalie takes on the dreaded snowplow man, and Dad gets into a showdown with a rival meteorologist."
145,An aloof investment banker's life spirals into peril and paranoia after his brother gives him an odd birthday gift: the chance to play a mysterious game.
150,A vampire warrior begins to question her mission in the ancient war between the undead and werewolves when she falls for a human under her protection.
152,"A bright and promising young girl gets abducted and taken to a terrorist camp, where she unexpectedly crosses paths with her soulmate."
153,A substitute teacher and an obsessive student begin an illicit affair that endangers everyone involved and blurs the line between predator and prey.
154,"A talented thief teams up with an aspiring actress to steal art from LA's high rollers. For their last heist, they're going for the ultimate: freedom."
157,Four seniors embark on misadventures after breaking out of their nursing home to save a loved one’s grave from demolition by estate developers.
161,Four seniors embark on misadventures after breaking out of their nursing home to save a loved one’s grave from demolition by estate developers.
171,"Years after getting his girlfriend pregnant, washed-up jock Vince meets his eccentric son Michael and learns about fatherhood, one show tune at a time."
172,"When three working-class teens enroll in an exclusive private school in Spain, the clash between them and the wealthy students leads to murder."
176,"As a killing resembling a cold case resurfaces in a small town, the chase for the truth falls on two policemen who each harbor secrets of their own."
182,Two young adults from very different backgrounds fall in love during a summer on Italy’s Adriatic Coast. Inspired by Federico Moccia's book series.
184,"In this lesbian-themed nod to the film Run Lola Run, a photographer races against the clock to make it to an important meeting on time."
205,"Isolated on a wind-ravaged 19th-century homestead, a frontierswoman begins to suspect that evil lurks in the terrifying emptiness all around her."
207,"A couple rents a villa in Italy hoping to mend their bruised relationship, but the devilishly charming homeowner can’t seem to leave them alone."
210,"A human girl secretly raised by robots starts to uncover the dark secrets behind her lush, utopian world where humanity has all but vanished."
213,"A human girl secretly raised by robots starts to uncover the dark secrets behind her lush, utopian world where humanity has all but vanished."
218,"When misfit alien Oh mistakenly sends a party invite to the entire galaxy, he goes on the run to avoid trouble and befriends spunky human girl Tip."
221,Self-centered Javier's life gets a bit messy when he unexpectedly becomes a superhero – and his recent ex is tasked with uncovering his identity.
229,"Real people sit down with friends and family to share terrifying true stories from their past, re-created through chilling re-enactments."
230,"Real people sit down with friends and family to share terrifying true stories from their past, re-created through chilling re-enactments."
231,"Real people sit down with friends and family to share terrifying true stories from their past, re-created through chilling re-enactments."
232,"Real people sit down with friends and family to share terrifying true stories from their past, re-created through chilling re-enactments."
239,A talented teen implicated in a robbery-turned-murder fights for his innocence and integrity against a criminal justice system that’s already judged him.
243,"In this heart-wrenching documentary, a 28-year-old Ph.D. student turns the camera on herself to capture her struggles with chronic fatigue syndrome."
249,"When two college roommates develop a discreet hookup app, casual affairs – and complications – soon run rampant on campus."
251,"After his affluent father passes, a man must survive seven days in the Nigerian neighborhood of Ajegunle, where obstacles keep him from his inheritance."
252,"Self-doubt, sacrifice and struggle converge into an existential crisis for a devoted classical vocalist as the mastery he strives for remains elusive."
254,"An accidental killing leads a man down a dark hole of intrigue and murder. Just as he finds love and freedom, one phone call brings back the nightmare."
255,Home-invasion horror comes to the trailer park when a family arrives at a mobile home community to find nobody there but a trio of masked murderers.
256,"Grieving for his dead wife and daughter, a trucker plunges into a romance with a mother who needs his help. The dead, however, are far from gone."
259,"Short on sense but long on self-confidence, dotty Deliha sets her sights on a hunky photographer who opens up shop in her neighborhood."
262,"A shy teen with the power to turn invisible must get it under control to help defend his neighborhood, putting aside the pursuit of his artistic dream."
269,"In the 1970s, a rivalry propels race car drivers Niki Lauda and James Hunt to fame and glory — until a horrible accident threatens to end it all."
271,"In the 1970s, a rivalry propels race car drivers Niki Lauda and James Hunt to fame and glory — until a horrible accident threatens to end it all."
274,"Rei helps the woman she’s been in love with for years escape her abusive husband. While on the run, their feelings for each other catch fire."
277,"A ruthless politician will stop at nothing to conquer Washington, D.C., in this Emmy and Golden Globe-winning political drama."
279,Rampaging serial killers leave carnage in their wake as their next victims fight to stay alive in this horror anthology series.
281,"For six engaged couples, happily ever after begins on a spectacular note in this eye-popping look at India’s multibillion-dollar wedding industry."
282,"In 1960s Paris, Madame Claude's influence extends beyond the world of sex work — until an affluent young woman threatens to change everything."
284,A rascally bird with a distinctive laugh pecks back with a vengeance when his forest habitat is threatened by a slick lawyer building his dream home.
294,Famed Polish pianist Wladyslaw Szpilman struggles to survive the onslaught of Nazi tyranny during World War II in this drama based on his memoirs.
296,"This true-crime documentary exposes new facts about alleged teen drug lord ""White Boy Rick"" and his lesser-known role as an FBI informant."
299,"This documentary explores Nigeria’s cultural practice of marking, including its origins and meaning as a symbol of identity, beauty and spirituality."
300,"In this hidden-camera prank comedy, two best friends bond on a wild road trip to New York as they pull real people into their raunchy, raucous antics."
304,"Love — and lies — spiral when a DNA researcher helps discover a way to find the perfect partner, and creates a bold new matchmaking service."
320,A troubled divorcée fixates on a seemingly ideal couple from afar until a shocking observation sends her spiraling straight into a knotty murder case.
324,"A murder investigation leads police to a photo of a suspect, but when two men are found with faces that match the picture, the case gets doubly tricky."
331,Life in the garage swerves off track for a NASCAR crew chief and his tight-knit racing team when a new boss steps in and shakes things up.
346,"When a prisoner transfer van is attacked, the cop in charge must fight those inside and outside while dealing with a silent foe: the icy temperatures."
348,Traverse the globe with the world's top riders as they pedal through rugged terrain and majestic locations in this visual homage to the bicycle.
352,"Bereft of opportunities in the aftermath of Hurricane Katrina, a young man and his close friends turn to a life of crime in the 9th Ward of New Orleans."
359,"After receiving a heart transplant from a murdered man, a cop is followed around by the victim’s ghost, who won’t rest until his death has been avenged."
364,"Haunted by visions after her sister vanished with her classmates 21 years before, Astrid begins an investigation that uncovers the dark, eerie truth."
366,Animation and activism unite in this multimedia spoken-word response to police brutality and racial injustice.
376,"After a heartbreaking loss, a grandfather struggling to reclaim his passion for painting finds the inspiration to create again."
383,An elite assassin wrestling with doubts about her work scrambles to protect herself — and her estranged family — after a hit goes dangerously wrong.
384,A tormented student uncovers unsettling secrets at her remote high school as betrayal and a paranormal encounter upend her life.
385,"After a serious accident, Lucie tries to rediscover herself as a dancer and meets Vincent, a talented b-boy battling his own insecurities."
386,"After a serious accident, Lucie tries to rediscover herself as a dancer and meets Vincent, a talented b-boy battling his own insecurities."
402,"As the owner of a group of international schools, a man gets caught in a series of scams as his wife, a principal, rules his life with an iron fist."
403,"When a billionaire hires a team of mercenaries for protection, they soon realize world-changing technology and his daughter’s life are also at stake."
406,This docudrama based on the same-titled book tracks the aftermath of a 1993 bombing in Bombay through the eyes of a journalist covering the story.
409,"Irked by her bodyguard, an heiress invents a secret admirer to throw him off his duties, but the plan may backfire when she falls for him."
412,Childhood friends Abhay and Aaliya experience plenty of obstacles in their paths as they find their way in the world and back to each other.
417,"In this long-running reality competition series, players battle the elements and each other as they vie for $1 million and the title of Sole Survivor."
419,"In this long-running reality competition series, players battle the elements and each other as they vie for $1 million and the title of Sole Survivor."
422,"From a resurfaced sex tape to a rogue suitcase of money, four wildly different stories overlap at the whims of fate, chance and one eccentric criminal."
423,"A sex therapist with pituitary issues finally gets to experience puberty in all its glory at age 30, when an operation unleashes his raging hormones."
427,"Brian knows there are creatures under his bed. When he faces his fears and confronts them, however, he makes some hilariously weird new friends."
446,"To clear his criminal record, an ex-special forces soldier agrees to lead a team to retrieve a double-crossing mercenary and deliver him to justice."
447,A group of singletons stumbles through the wild dating scene in Nairobi as two friends wonder if their relationship is more than platonic.
461,"While visiting her fiancé's mother in southern Italy, a woman must fight the mysterious and malevolent curse intent on claiming her daughter."
466,A group of vastly outnumbered U.S. soldiers at a remote Afghanistan base must fend off a brutal offensive by Taliban fighters in the Battle of Kamdesh.
468,"A widowed father of two girls navigates the world of dating, surprised to learn that many women consider him a hot commodity."
474,A man's relationship with his jealous wife enters choppy waters after he has to spend a night on a yacht with a woman he's rescued from gangsters.
480,"Raised in the privileged bubble of Delhi's elite, a teen is compelled to question his outlook on life and love when his older brother comes out as gay."
486,"A small-town man takes on a dangerous gangster to avenge his father, a police officer who ended his own life after being framed in a deadly crime."
489,"Passed off as spies, two inept pals are sent to Fiji to rescue a kidnapped bureaucrat. Soon enough, they’re creating more problems than they’re solving."
498,"Fed up with their families and classmates, two teen girls from a wealthy part of Rome are drawn to the city's underworld and start leading double lives."
508,"Aboard a spaceship where souls of the deceased are readied for reincarnation, a lone crew member’s rigid existence is disrupted by a spry new assistant."
509,"Aboard a spaceship where souls of the deceased are readied for reincarnation, a lone crew member’s rigid existence is disrupted by a spry new assistant."
514,"Fresh out of prison, an ex-con tries to save his debt-ridden brother and the family pub until local mobsters draw him back to a criminal underworld."
529,A plucky young orphan sent to live with her grandfather in the mountains discovers wonder and adventure around every corner.
531,"Eager to hook up with a woman he met online, 18-year-old Ian embarks on an epic road trip that speeds straight toward trouble in this raunchy comedy."
535,"When his unlucky horoscope doesn’t bode well for his future wife, an earnest bachelor goes to surprising lengths to get the family he’s always wanted."
538,Two brothers — one a narcotics agent and the other a general — finally discover the identity of the drug lord who murdered their parents decades ago.
539,A group of university students decides to test an urban legend about the ghost of a female student that haunts a campus bridge.
545,"To protect his family from ruin, Yogesh must marry his dream girl in only ten days, so he rushes into dating women with different astrological signs."
551,Flight Lieutenant Gunjan Saxena makes history in her journey from aspiring aviator to India’s first female combat pilot in the Kargil War.
553,A night at a 1980s heavy metal concert hits a grisly note when new friends find themselves in the middle of a satanic murder spree.
555,"Six years after a brutal virus wipes out most of Scandinavia's population, two siblings join a band of young survivors seeking safety – and answers."
557,"In major debt to a loan shark, a nightclub owner who's entered in a celebrity death pool tries to murder a famous figure for half a million dollars."
558,"When their leader is captured by an extremist organization, a special forces team stages a perilous rescue mission as time runs out."
561,"While her free-living bestie urges her to embrace singlehood, a commitment-craving social media expert can't stop following the life of a former love."
564,"Newly released from prison, a man returning to his girlfriend and their child subsequently learns about a dangerous debt taken by his late mother."
575,"In the south of France, three best friends in their 40s navigate loss and heartbreak while embarking on steamy affairs with much younger men."
577,A man undergoes a heart transplant following a serious injury and begins to take on some of the donor's motherly characteristics.
579,"Discovering his ties to a secret ancient order, a young man living in modern Istanbul embarks on a quest to save the city from an immortal enemy."
583,"An outspoken, imaginative girl from a conservative family pursues her dream man while fending off the prospect of an arranged marriage."
585,"Ambitious Kunal takes a job in the diamond business, but his life is thrown into turmoil when he's drawn into the seedy underworld of his new career."
589,"Disowned by his father as a boy, Surya is taken in by a crime boss. When his brother Shiv is wrongly imprisoned, his father pleads for Surya's help."
604,"After a dedicated cop accidentally kills a 12-year-old boy, he's fired, harassed and forced to take menial work as he tries to keep his life together."
607,The lives of a Mumbai man and woman who are both dealing with issues intersect through a TV dance show that she wants to win but he wants to sabotage.
610,"Learning of a fortune in gold being secretly shipped to Romania, master thieves Charlie and Riya assemble a crack team to steal it."
618,"After drunkenly sending a cringeworthy email, hopeless romantic Wes heads to Mexico with her best friends to erase the note before her new love reads it."
621,"To win his true love's heart, wide-eyed Tristan Thorn journeys to a forbidden realm to retrieve a fallen star that has taken human form."
629,"Paired together for an unforgettable trip across Asia, stars Lee Seung-gi and Jasper Liu become buddies as they connect with fans and local cultures."
630,"Torn between his past and present girlfriends, a confused bachelor’s indecisiveness spins a web of lies and cheating as he struggles to commit."
634,"Shattered after her mother's death, a woman floats away from reality under the effect of a potent, hallucinatory drug as her life decays into chaos."
642,"Out to avenge his mother's death, a college student pledges a secret order and lands in a war between werewolves and practitioners of dark magic."
644,"Following her father's death, a young woman struggles to help her mother keep the family ranch afloat while preserving a special bond with her horse."
645,"When disaster strikes mid-flight, a commercial plane's frantic passengers confront their pasts and the possibility of death. Based on true events."
646,"After bringing home a set of mysterious stones from the Grand Canyon, a boy unleashes an ancient force that begins to terrorize his family."
650,"For a tech-savvy thief, elaborate robberies and evading the police are second nature until a private detective is hired to investigate his latest heist."
657,"A bank robber joins a plot to commit one final, historic heist before the government turns on a mind-altering signal that will end all criminal behavior."
659,"Equipped with limited resources, an isolated group of individuals is subjected to the harsh conditions of the wilderness and must survive — or tap out."
662,"Equipped with limited resources, an isolated group of individuals is subjected to the harsh conditions of the wilderness and must survive — or tap out."
663,"Equipped with limited resources, an isolated group of individuals is subjected to the harsh conditions of the wilderness and must survive — or tap out."
672,A well-to-do British woman must venture into New Zealand's wild and dangerous unknown when her baby son is kidnapped and held for ransom.
677,A woman ends up working at the same nightclub as her son’s girlfriend — who she doesn’t like — and tries to break up their relationship.
678,A woman ends up working at the same nightclub as her son’s girlfriend — who she doesn’t like — and tries to break up their relationship.
679,A woman ends up working at the same nightclub as her son’s girlfriend — who she doesn’t like — and tries to break up their relationship.
681,"A wrongly accused man is pursued by a dogged investigator in this action-comedy featuring car chases, dark humor and more than a few vampires."
690,"Sick of his parents’ constant squabbling, a young man travels back in time to the onset of their romance, with plans to set them up for marital bliss."
693,A reformed LA gang member upends his peaceful new life when he steps in to protect two young immigrants from his violent former leader.
695,Dubai residents struggle to figure out why a fleet of alien spaceships are hovering over their city when all contact with the outside world is cut off.
698,"Join former first lady Michelle Obama in an intimate documentary looking at her life, hopes and connection with others as she tours with ""Becoming."""
709,"As a visually impaired man attempts to rescue his love interest from a serial killer, the dark story behind the murderer’s disturbing psyche emerges."
711,"A broke caregiver unexpectedly inherits her patient's estate, but dark secrets swirl around her newfound wealth, tangling her in deceit and danger."
714,A Istanbul mobster falls for an Indian yoga instructor whose abduction takes him on a wild rescue mission to Mumbai.
