,description_x
2087,"Years after surviving a brutal crime as a child, Libby Day comes to believe that the brother she testified against for committing it may be innocent."
2093,"Finding a letter mailed to Santa by a girl asking for a new wife for her daddy, twentysomething Crystal sets out to make the girl's wishes come true."
2094,Two federal agents battle through an army of rioting prisoners – and their sense of reality – inside a high-tech prison modeled after Dante’s Inferno.
2095,Two federal agents battle through an army of rioting prisoners – and their sense of reality – inside a high-tech prison modeled after Dante’s Inferno.
2099,A man with a history of mental issues moves into his late parents' mansion and comes to suspect his new home may be haunted.
2101,A man with a history of mental issues moves into his late parents' mansion and comes to suspect his new home may be haunted.
2102,A man with a history of mental issues moves into his late parents' mansion and comes to suspect his new home may be haunted.
2103,A man with a history of mental issues moves into his late parents' mansion and comes to suspect his new home may be haunted.
2104,"In a severe, drought-ravaged dystopia, the youngest of a farm family starts a quest for revenge after his brothers betray him and leave him for dead."
2105,"Along with her son and best friend, a grieving widow hikes into the woods to scatter her late husband's ashes, only to discover they're being stalked."
2106,"Along with her son and best friend, a grieving widow hikes into the woods to scatter her late husband's ashes, only to discover they're being stalked."
2109,"Seeking a missing woman in North Dakota, an FBI agent and a sheriff focus on her religious zealot husband but discover something far more sinister."
2115,"A Copenhagen police officer hunts for the man who attacked his partner, only to stumble into a high-stakes game of espionage."
2117,"A Copenhagen police officer hunts for the man who attacked his partner, only to stumble into a high-stakes game of espionage."
2121,A special ops squad investigating a distress signal from a distant planet discovers that mutant aliens have already wiped out most of the population.
2133,"A suburban couple hires a new sitter to watch their three kids for the night, unaware that the young woman isn't who she claims to be."
2142,"After a paramedic’s violent death during a weekend trip, his spirit inhabits his friends’ bodies in an effort to save them from a similar fate."
2145,"When James's living situation turns sour, he has little choice but to move in with his new girlfriend – a decision he almost immediately regrets."
2146,"Mistakenly accused of kidnapping, a veteran soldier leaves a trail of broken bad guys in his wake as he tries to rescue a teen sex trafficking victim."
2147,"Two former friends, who now live far apart, learn about each other's insecurities and secrets over a series of video chats."
2150,"Following a night of hard partying that left their tycoon boss dead, four women try to keep it a secret in hopes of closing a billion-dollar deal."
2158,"A stock broker brings his young son back to the town where he grew up for a hunting trip, but things take a dangerous turn when they witness a crime."
2159,A young couple fights supernatural foes in an attempt to save their daughter from the dark and mysterious forces that follow her every move.
2164,"Teenage Xue Ming was forced to marry the man who raped her. Years after abandoning her young sons to find a better life, can she escape the guilt?"
2170,A devout preacher's son leaves his protective home to begin college and meets a self-reliant student who will test his faith and his heart.
2171,A popular college student's love of social media becomes her biggest regret when a mysterious account marks each of her friends for a grisly demise.
2177,"Kyle helps people disappear, but when a crazed killer starts hunting down his latest client, he has to decide what he's willing to do to keep her safe."
2181,Developers looking for a location to build a resort on Saipan stumble into a subterranean bunker from WWII where an evil force lies in wait.
2185,"Despite growing up with traits that set her apart from her peers, a young adopted girl discovers her gift when she takes an interest in spelling bees."
2188,"While visiting the site of a supernatural shrine in the Thai countryside, a vacationing couple unwittingly upsets a vengeful demon."
2189,"After selling his soul to save a loved one, daredevil biker Johnny Blaze pays the price by becoming a flame-skulled bounty hunter for Mephistopheles."
2196,"After a fire breaks out at his church, a pastor faces a legal battle against university leaders who wish to push the congregation off the campus."
2200,"When a bold teen mounts a gritty pursuit to dance in a music video, she must also evade child services so she can keep her younger sisters together."
2204,"Hoping to give their relationship a boost, Jenna and Kate arrange to spend an evening with a third woman, but things take a turn once the sparks fly."
2215,"Leaving their wives at home, three randy friends look forward to some raunchy extramarital fun at their college reunion."
2220,"A homicide detective, a criminal profiler and a journalist team up to nab a serial killer whose murders are inspired by the classic game of Hangman."
2222,"On the run from his meth-dealing employers, a drifter with a drinking problem becomes prey in a desert town's twisted hunting contest."
2224,A drug dealer who's been emulating his father's successful criminal career is forced to go on the run with a young girl in this fact-based thriller.
2226,"When a fraternity's last big luau serves up horrible deaths to its partygoers, the brothers learn firsthand about their house’s frightening history."
2228,"An alcoholic with a tragic past rents an apartment in a building for those in recovery, but soon learns the truth about residents who get ""evicted."""
2229,"While vacationing at a remote lake house, a mother and her daughters become pawns in the twisted game of an ax-wielding psychopath."
2230,A group of college students on a weekend getaway accidentally summon a supernatural entity intent on using them for its deadly ritual.
2232,"While investigating a possible outbreak at an Arctic research facility, scientists discover a new virus that could wipe out every human on the planet."
2234,Former Confederate soldier Cullen Bohannon sets out on a quest to find his wife's killer as post-Civil War America struggles to rebuild its identity.
2237,"This fast-paced action flick tells the dark story of Hellboy, a charismatic demon who's put on Earth by the Nazis to terrorize the rest of the world."
2246,"A pugilist from Shantung struggles to rise to the top of the Shanghai triad ladder, where his stellar martial arts talents can shine."
2248,"A pugilist from Shantung struggles to rise to the top of the Shanghai triad ladder, where his stellar martial arts talents can shine."
2249,"While serving as the marshal of rowdy Abilene, Kansas, ""Wild Bill"" Hickok uses guns and gall to tidy up the lawless frontier town."
2250,"Years after an accident at a wild Christmas party traumatized them all, six former friends find themselves trapped in a shopping mall and forced by a killer disguised as Santa Claus to play a lethal game of hide-and-seek."
2251,"While living a comfortable life with his wife and child, a germophobic man realizes his estranged brother may have committed a terrible crime."
2252,"In a plot to bait the snake-goddess Nagin for her immortality-granting essence, George States journeys to India and abducts her reptilian lover."
2255,"Eight gleefully grim short tales set on Halloween, Mother's Day, St. Patrick's Day and other holidays comprise this chilling horror anthology."
2256,An ex-member charts his path from idealism to disenchantment in a California cult when alarming revelations about the group's leader come to light.
2258,"Fresh off a top-secret training, feisty heroine Little Red teams up with intrepid reporter Wolf to investigate the disappearance of Hansel and Gretel."
2260,"When a teen with terminal cancer miraculously finds herself in remission, she struggles to give up the attention her illness gave her at school."
2262,"On a dare, seven college friends spend a night at an abandoned hotel rumored to be haunted and find themselves trapped in a nightmare."
2263,"Two teenage geeks inadvertently find a lifelike, state-of-the-art sex robot, but must dodge the high-profile owner who lost her in order to keep her."
2264,"When a resourceful but flighty Londoner is threatened with eviction, she vows to do whatever it takes to defeat a greedy real estate agent."
2269,"Dray lives life one woman at a time and is the envy of all his friends, until his sister decides to show him the error of his philandering ways."
2270,"While filming his daily life for a media course, Cowen discovers his small English town may be under an ominous and otherworldly influence."
2271,"Four individuals in modern India grapple with their identities amid social taboos, trauma and brutal sexual discrimination in this quartet of stories."
2274,"When a tough-minded ex-drug dealer falls for a beautiful but highly devout woman, their mutual attraction takes them both down a twisty path."
2275,"Four hundred years after they were frozen in time, a Ming Dynasty guard and his three pursuers are defrosted to continue their ancient battle."
2279,"When an imprisoned terrorist cell hijacks a high-security prison in outer space, a CIA agent becomes the one chance of stopping them."
2280,A couple trying to conceive invite a woman with a mysterious past to move in with them. But it's an invitation they might come to regret.
2281,A couple trying to conceive invite a woman with a mysterious past to move in with them. But it's an invitation they might come to regret.
2284,Five viral Internet celebrities travel to a competition that will award one of them their own television series in this ensemble comedy.
2285,"In the near future, two frightened sisters fight for survival after losing their father during a deadly, quietly looming apocalypse."
2292,Two young lovers in Banaras are caught in the crossfire of a feud between their powerful families and a political climate destroying their city.
2295,A lottery ticket salesperson faces an ethical dilemma after setting aside a soon-to-be winning ticket for a customer to pick up and pay for later.
2298,A lottery ticket salesperson faces an ethical dilemma after setting aside a soon-to-be winning ticket for a customer to pick up and pay for later.
2300,A lottery ticket salesperson faces an ethical dilemma after setting aside a soon-to-be winning ticket for a customer to pick up and pay for later.
2316,"In this family film, never-dull third-grader Judy Moody embarks on a summer adventure with her brother, Stink, and always-up-for-fun Aunt Opal."
2320,A cop who killed a mobster's son and fled to a small town with a changed identity finds his quiet new life disrupted when he becomes a local hero.
2323,"A popular singer on the run poses as a bartender and falls in love with a prostitute, but their love is threatened by a violent incident in his past."
2326,A scientist trying to solve one of the universe's greatest puzzles begins a romance with a much younger colleague that's haunted by a dark secret.
2327,"When flashbacks reveal that he's the reincarnation of a man murdered by his wife, rock star Monty sets out to get revenge for the decades-old crime."
2333,"While playing matchmaker to a pair of their friends, two young university students begin developing feelings for each other."
2334,"Sloan's vow to never return to Thailand is cut short when he's kidnapped and taken to a Thai prison, where he's forced to fight a 400-pound brute."
2337,"Posing as a telecom salesman at a business conference, a CIA agent fights to protect a fledgling Eastern European democracy from a military coup."
2338,"After a whirlwind romance, Jen and Spencer settle into married life — until Spencer's secret past as a hit man shakes up their suburban bliss."
2343,"A wealthy, despicable businessman comes to the realization that he may lose half his fortune to the obnoxious wife he's trying to divorce. So, he decides to arrange his own kidnapping in order to wipe himself out and claim poverty."
2346,A foster mom and her houseful of kids befriend a bitter neighbor after the Rodney King verdict is handed down in 1992 Los Angeles.
2348,A field hockey-playing pizza delivery boy finds himself transformed from slacker to zombie slayer during an outbreak of the undead in Kuala Lumpur.
2349,A devoted husband and father on his own for the weekend has his life turned inside out after giving shelter to two young women during a storm.
2350,A devoted husband and father on his own for the weekend has his life turned inside out after giving shelter to two young women during a storm.
2363,An ex-CIA contractor turned thief is forced to head a CIA gambit to infiltrate a black ops Mexican prison and steal $50 million in drug cartel money.
2370,A motley crew of apocalypse survivors living at an abandoned truck stop never suspects that the pregnant woman among them is carrying the Messiah.
2373,A young woman's attempt to come out of the closet on Thanksgiving gets complicated when her male roommate shows up to her parents' home unannounced.
2374,"A shapeshifter has to kill, then inhabit his victims, or die. But as his need for new bodies speeds up, he finally faces down his own mortality."
2384,A government agent wrongly accused of a crime gets a shot at freedom if he can engineer a high-risk rescue mission to outer space.
2386,A young man and woman fall in love but are threatened to be torn apart by the tensions between their Latino and Caucasian communities in Arizona.
2392,"During an uprising in Russia's St. Petersburg, teen girl Lucky meets handsome Aditya, the Indian ambassador's son, and together they flee the chaos."
2395,"Devin Overstreet may be the class valedictorian, but he hasn't had much life experience. Enter Mac Johnson, a 10th-year senior and weed dealer."
2407,"After receiving a strange present, a professor and his pregnant wife are plagued by tragedy and a paranormal presence that's determined to kill."
2415,An Indian business owner struggles to keep his company afloat amid global competition while trying to make up for lost time with his family.
2416,"When criminal psychologist Kate Fuller investigates a man who was seemingly murdered in his sleep by his wife, she uncovers a case like no other."
2417,"When criminal psychologist Kate Fuller investigates a man who was seemingly murdered in his sleep by his wife, she uncovers a case like no other."
2419,"When his wife goes missing, university professor Saurabh remains at home while the police investigate, but his grip on reality loosens as days pass."
2420,Fact meets fiction in this docudrama chronicling the journey of a spacecraft crew as it embarks in 2033 on a mission to colonize the red planet.
2425,A single man in his 30s overwhelmed by his domineering mother meets a lesbian couple willing to go to extreme lengths to have a child.
2432,A hedonistic soccer mom takes a voyage of self-discovery when she tries to reconnect with her son by returning his pet rock to a Mediterranean island.
2439,A modern love story is connected to an ancient folk tale as star-crossed lovers from different social classes are kept apart by their families.
2442,"With their divorce set to become final on Christmas day, a couple must decide if they're really ready to throw in the towel on their relationship."
2446,"During the War of 1812, two Native Americans and their British ally are pursued into enemy territory by American soldiers thirsting for revenge."
2448,A lethal game of cat and mouse stretches from the desert to Tinseltown after Hollywood bad boy Thomas runs afoul of a cunning and dangerous drifter.
2454,A talking monkey famous for his TV commercials dreams of breaking into real movies. But first he stumbles upon a brother and sister who need his help.
2455,A family’s festive Halloween plans take a spooky turn when an evil witch's curse transforms the costumed clan into actual monsters.
2464,"When a self-help author learns that his mother has fallen for his sadistic high school gym teacher, he tries to put a stop to their budding romance."
2469,A recently dumped attorney hires a psychic to help her win back her boyfriend. Things take an unexpected turn when another ex re-enters the picture.
2470,"Amid the chaos and horror of World War II, a committed German soldier fights a private battle with his own conscience."
2471,"Recently paralyzed in a devastating car accident, Dana begins to suspect a dark and sinister force may be lurking within her hospital room."
2473,"The biggest pranksters on YouTube – VitalyzdTV, Dennis Roady and Roman Atwood – turn Hollywood into ""Prankwood"" with their most over-the-top stunts."
2476,"As the new kid, a shy high school senior finds himself tormented by all his peers except one. But his new friend has a dark, infectious outlook."
2484,"Stressed by his duties as king and father, Norm must secretly find his stolen crown while taking his family on a much-needed vacation."
2485,"When Norm the polar bear is framed for a crime he didn’t commit, his friends step up to help him clear his name."
2486,"Before planning an awesome wedding for his grandfather, a polar bear king must take back a stolen artifact from an evil archaeologist first."
2487,An 18-year-old struggling to understand her best friend's suicide talks to teenagers who have grappled with mental illness and suicidal thoughts.
2488,"Dissatisfied with the police’s progress, a teen and his best friend investigate their classmate's murder, treading down a dark path to the uneasy truth."
2493,Fallen Los Angeles police officer Terrence Downe finds new life as a secret weapon: a scientifically altered super-cop with unlimited lives.
2499,An obsession with a woman with whom he had a one-night stand brings disharmony into a man's life and destroys his peace of mind.
2500,"After saving a deer from a hunter's clutches, a domesticated grizzly finds himself relocated to the wild – and unprepared for the real world."
2505,"A young man invents a device he hopes will generate wireless energy, but instead, it proves to spark sinister, supernatural activity in his home."
2509,"A young newlywed tries to keep her relationship afloat after developing feelings for her older, TV writer boss."
2513,"Desperate for a place to live, twentysomething bachelors Parikshit, Jayesh, Parag and Bhavesh finally locate a house to rent, only to learn that the landlords will consider married applicants only."
2524,India's highlands descend into bullet-riddled mayhem as the longtime rivalries and ruthless revenge missions among four men come to a head.
2534,"In pre-World War II France, two sisters purport to be able to communicate with the dead and soon catch the eye of an ambitious filmmaker."
2537,"After being recruited to be a raconteur in London, a handsome teenager discovers he suffers from a rare condition where he faints upon seeing fine art."
2538,"Two men who grew up in Mumbai's slums are drawn into the city's brutal narcotics trade, where they fight on opposite sides of the law."
2542,"When a confident college professor is courted by four eligible and well-established men, she struggles to decide who she likes the best."
2559,Explore the icky world of rats and witness how their talent for surviving in almost any environment has led to catastrophic events throughout history.
2562,"Bollywood superstar Salman Khan plays Prem, an heir to a perfume fortune who falls in love with the wrong woman in this romantic comedy."
2563,"Struggling to move on from a heartbreaking loss, Mikey is drawn into a dangerous underworld robbery orchestrated by his unreliable stepbrother Dale."
2564,A family Christmas gathering at an isolated Australian estate turns into the holiday from hell after a mysterious stranger turns up at the door.
2568,"Tyler's still feeling lost following the tragedy that's strained his relationship with his father when he meets Ally, a girl who understands his pain."
2573,"After a mother and her daughter are gang-raped by seven men, the daughter suffers a mental breakdown, and the single mom sets out to get revenge."
2575,"In gritty 1980s New York, two Chinese immigrant boys rise through the ranks of the infamous Green Dragons gang, where they're trained to kill."
2578,"A heartbroken wildlife photographer throws himself into his work, only to find himself experiencing strange transformations."
2580,"When the Sheriff of Nottingham takes his beloved captive, Robin Hood embarks on a daring rescue mission at the tyrant's castle."
2583,"Sylvester Stallone shot to fame as Rocky Balboa, an unknown fighter who's given a shot at fighting world champ Apollo Creed as a publicity stunt."
2587,"Inspired by the memory of his trainer, a broke and seemingly careerless Rocky finds glory in training and takes on an up-and-coming boxer."
2588,"Hoping to earn money to support her son, a single mother sings in a nightclub, where danger lurks around every corner."
2589,"Kidnapped, confined to a tiny room and raped, a young woman gives birth to a son. When he reaches his fifth birthday, she begins plotting an escape."
2591,"To save his parents’ home, a lottery-squandering 32-year-old man sublets a room to a disarmingly creepy tenant."
2597,Siddharth falls in love with beautiful Jhanvi. But Jhanvi's brother Ganpat is overly possessive – and determined to destroy their relationship.
2598,Siddharth falls in love with beautiful Jhanvi. But Jhanvi's brother Ganpat is overly possessive – and determined to destroy their relationship.
2600,"Sparks fly when a newspaper columnist writes a one-sided, sexist story about a commitment-phobic bride who abandoned three men at the altar."
2602,"Held hostage by men searching for a secret her late husband left behind, a recent widow and her family race against time to find a way out."
2604,"A spunky terrier named Russell with serious wrestling chops becomes a sports phenomenon with the help of his coach, a monkey named Hunk."
2606,"A veteran cop is tasked with drafting and training a special weapons and tactics team, who soon find themselves up against an international criminal."
2607,"High schooler Sadie Mitchell believes the world is about to end – literally. Before it does, she sets out to kiss a boy and win back her best friend."
2613,The Biblical story of Samson becomes this sword-and-sandals epic about an Israelite warrior whose God-given brawn is undone by a beautiful temptress.
2615,"When a gift sack full of kittens gives Santa a bad allergic reaction, the kitties have to take over and deliver the presents on time."
2616,"When a gift sack full of kittens gives Santa a bad allergic reaction, the kitties have to take over and deliver the presents on time."
2618,"In the course of a human trafficking investigation, a conservative cop crosses paths with an artist-activist in a clash of worldviews."
2622,A seemingly ordinary girl learns she will turn into a mermaid on her 12th birthday and be forced to leave her life on land behind.
2623,"A powerful team of Washington, D.C. lawyers makes scandals disappear while handling government crises and coping with problems of their own."
2624,"The Wayans brothers spoof some of Hollywood's biggest blockbusters, including Scream, I Know What You Did Last Summer, The Matrix and American Pie."
2625,"Taking aim at not only the horror genre but also films like ""Black Swan"" and ""Inception,"" ""Scary Movie 5"" widens the franchise's scope of mockery."
2632,"Desperate for cash, klutzy private investigator Tekin searches for a wealthy woman's missing girl but faces one surprise and mishap after another."
2634,"Best friends Carrie, Miranda, Samantha and Charlotte take a break from their busy New York lives for an all-expenses-paid luxury vacation to Abu Dhabi."
2635,"A high-end call girl falls for a handsome man she meets at a nightclub, but he harbors a secret that throws a wrench in their relationship."
2639,"Unable to bribe his way out of a reckless driving charge, an arrogant rich kid is sentenced to community service at a home for senior citizens."
2642,A forensic psychiatrist has to think outside the box when she takes on a patient whose multiple personalities lead to a trail of murder victims.
2651,"A young man enrolls at a college and becomes a rival to the student-union president, who’s using force and intimidation to advance his criminal agenda."
2661,"When a drug lord kidnaps his girlfriend’s daughter, a retired assassin leaves his newly peaceful life to go on a ruthless rampage to rescue the child."
2664,"Nearly a century after artificial intelligence tried to eradicate people from Earth, two survivors search for a human enclave rumored to still exist."
2666,A groom-to-be and his pals celebrate with a debauched night out that ends with a supernatural assault by a stripper who is not what she appears to be.
2668,A groom-to-be and his pals celebrate with a debauched night out that ends with a supernatural assault by a stripper who is not what she appears to be.
2669,"After the death of their beloved mother, three foster sisters find their bond tested by old grudges, career tensions and a startling revelation."
2670,"After a wild night of partying, Terry discovers that he's one of the few people left on Earth, then sets out to solve the mystery of what happened."
2672,"A divorcée moves into a high-rise with a sordid past and begins a steamy affair with her neighbor, unaware that her every move is being monitored."
